{
  "$schema": "https://json-schema.org/draft/2020-12/schema",
  "$id": "https://xsyetopz.github.io/OpenJoystickDriver/schemas/v1alpha1/controller-patch.schema.json",
  "description": "A RFC 7396 merge patch for controller records. A null deletes a key, an array replaces the array. The patched record is validated against controller.schema.json.",
  "type": "object",
  "additionalProperties": false,
  "required": ["apiVersion", "kind", "selector", "patch"],
  "properties": {
    "apiVersion": {
      "const": "openjoystickdriver/v1alpha1"
    },
    "kind": {
      "const": "ControllerPatch"
    },
    "selector": {
      "description": "The records the patch applies to. Inside one layer, model beats vendorID and productID, which beat all.",
      "oneOf": [
        {
          "type": "object",
          "additionalProperties": false,
          "required": ["all"],
          "properties": {
            "all": {
              "const": true
            }
          }
        },
        {
          "type": "object",
          "additionalProperties": false,
          "required": ["vendorID", "productID"],
          "properties": {
            "vendorID": {
              "type": "integer",
              "minimum": 1,
              "maximum": 65535
            },
            "productID": {
              "type": "integer",
              "minimum": 0,
              "maximum": 65535
            }
          }
        },
        {
          "type": "object",
          "additionalProperties": false,
          "required": ["model"],
          "properties": {
            "model": {
              "description": "The model id, vvvv-pppp in lowercase hex until records carry their own.",
              "type": "string",
              "pattern": "^[0-9a-f]{4}-[0-9a-f]{4}$"
            }
          }
        }
      ]
    },
    "patch": {
      "type": "object",
      "minProperties": 1,
      "additionalProperties": false,
      "properties": {
        "protocol": {
          "type": ["object", "null"]
        },
        "modes": {
          "anyOf": [
            {
              "$ref": "controller.schema.json#/$defs/modes"
            },
            {
              "type": "null"
            }
          ]
        },
        "usb": {
          "type": ["object", "null"]
        },
        "bluetoothLE": {
          "type": ["object", "null"]
        },
        "ownership": {
          "anyOf": [
            {
              "$ref": "controller.schema.json#/$defs/ownership"
            },
            {
              "type": "null"
            }
          ]
        },
        "route": {
          "anyOf": [
            {
              "$ref": "controller.schema.json#/$defs/route"
            },
            {
              "type": "null"
            }
          ]
        },
        "output": {
          "type": ["object", "null"]
        },
        "input": {
          "type": ["object", "null"]
        },
        "tuning": {
          "type": ["object", "null"],
          "additionalProperties": false,
          "properties": {
            "stickDeadzone": {
              "anyOf": [
                {
                  "$ref": "controller.schema.json#/$defs/tuning/properties/stickDeadzone"
                },
                {
                  "type": "null"
                }
              ]
            },
            "inputLivenessTimeoutMs": {
              "anyOf": [
                {
                  "$ref": "controller.schema.json#/$defs/tuning/properties/inputLivenessTimeoutMs"
                },
                {
                  "type": "null"
                }
              ]
            },
            "hidStartupIntervalMs": {
              "anyOf": [
                {
                  "$ref": "controller.schema.json#/$defs/tuning/properties/hidStartupIntervalMs"
                },
                {
                  "type": "null"
                }
              ]
            },
            "minimumHIDOutputIntervalMs": {
              "anyOf": [
                {
                  "$ref": "controller.schema.json#/$defs/tuning/properties/minimumHIDOutputIntervalMs"
                },
                {
                  "type": "null"
                }
              ]
            },
            "hidStartupRecoveryIntervalMs": {
              "anyOf": [
                {
                  "$ref": "controller.schema.json#/$defs/tuning/properties/hidStartupRecoveryIntervalMs"
                },
                {
                  "type": "null"
                }
              ]
            },
            "hidStartupRecoveryRounds": {
              "anyOf": [
                {
                  "$ref": "controller.schema.json#/$defs/tuning/properties/hidStartupRecoveryRounds"
                },
                {
                  "type": "null"
                }
              ]
            }
          }
        }
      }
    }
  },
  "if": {
    "properties": {
      "selector": {
        "required": ["all"]
      }
    }
  },
  "then": {
    "properties": {
      "patch": {
        "required": ["tuning"],
        "propertyNames": {
          "const": "tuning"
        }
      }
    }
  }
}
