{
  "apiVersion": "openjoystickdriver/v1alpha1",
  "kind": "ControllerPatch",
  "selector": {
    "vendorID": 1356,
    "productID": 1477
  },
  "patch": {
    "modes": [
      {
        "id": "default",
        "protocol": {
          "family": "SonyDualShock4",
          "parameters": {
            "motionCalibration": "Factory",
            "motionScale": "StrikePad"
          }
        }
      }
    ]
  }
}
