{
  "apiVersion": "openjoystickdriver/v1alpha1",
  "kind": "ControllerPatch",
  "selector": {
    "vendorID": 1356,
    "productID": 2508
  },
  "patch": {
    "modes": [
      {
        "id": "default",
        "protocol": {
          "family": "sony.dualshock4",
          "parameters": {
            "motionCalibration": "Factory"
          }
        }
      }
    ]
  }
}
