{
  "apiVersion": "openjoystickdriver/v1alpha1",
  "kind": "ControllerPatch",
  "selector": {
    "vendorID": 5426,
    "productID": 4114
  },
  "patch": {
    "modes": [
      {
        "id": "default",
        "protocol": {
          "family": "sony.dualsense",
          "parameters": {
            "maker": "ThirdParty",
            "unprobedTouchpad": true
          }
        }
      }
    ]
  }
}
