{
  "apiVersion": "openjoystickdriver/v1alpha1",
  "kind": "ControllerPatch",
  "selector": {
    "vendorID": 121,
    "productID": 6
  },
  "patch": {
    "modes": [
      {
        "id": "default",
        "protocol": {
          "family": "hid.descriptor"
        }
      }
    ],
    "input": {
      "hidUsageMap": {
        "usages": [
          {
            "kind": "button",
            "page": 9,
            "usage": 1,
            "control": "face-north"
          },
          {
            "kind": "button",
            "page": 9,
            "usage": 2,
            "control": "face-east"
          },
          {
            "kind": "button",
            "page": 9,
            "usage": 3,
            "control": "face-south"
          },
          {
            "kind": "button",
            "page": 9,
            "usage": 4,
            "control": "face-west"
          },
          {
            "kind": "button",
            "page": 9,
            "usage": 5,
            "control": "left-shoulder"
          },
          {
            "kind": "button",
            "page": 9,
            "usage": 6,
            "control": "right-shoulder"
          },
          {
            "kind": "button",
            "page": 9,
            "usage": 7,
            "control": "left-trigger-button"
          },
          {
            "kind": "button",
            "page": 9,
            "usage": 8,
            "control": "right-trigger-button"
          },
          {
            "kind": "button",
            "page": 9,
            "usage": 9,
            "control": "view"
          },
          {
            "kind": "button",
            "page": 9,
            "usage": 10,
            "control": "menu"
          },
          {
            "kind": "button",
            "page": 9,
            "usage": 11,
            "control": "left-stick-click"
          },
          {
            "kind": "button",
            "page": 9,
            "usage": 12,
            "control": "right-stick-click"
          },
          {
            "kind": "axis",
            "page": 1,
            "usage": 48,
            "control": "left-stick-x"
          },
          {
            "kind": "axis",
            "page": 1,
            "usage": 49,
            "control": "left-stick-y"
          },
          {
            "kind": "axis",
            "page": 1,
            "usage": 50,
            "control": "right-stick-x"
          },
          {
            "kind": "axis",
            "page": 1,
            "usage": 51,
            "control": "right-stick-x"
          },
          {
            "kind": "axis",
            "page": 1,
            "usage": 52,
            "control": "right-stick-y"
          },
          {
            "kind": "axis",
            "page": 1,
            "usage": 53,
            "control": "right-stick-y"
          },
          {
            "kind": "hat",
            "page": 1,
            "usage": 57,
            "control": "dpad"
          },
          {
            "kind": "button",
            "page": 1,
            "usage": 133,
            "control": "guide"
          },
          {
            "kind": "button",
            "page": 12,
            "usage": 178,
            "control": "share"
          },
          {
            "kind": "button",
            "page": 12,
            "usage": 547,
            "control": "guide"
          },
          {
            "kind": "button",
            "page": 12,
            "usage": 548,
            "control": "view"
          }
        ]
      }
    }
  }
}
